{
  "$schema": "../../schema/gateway-config.schema.json",
  "schemaVersion": 1,
  "gateway": {
    "name": "Synthetic large-source gateway",
    "hostname": "large-source.example.com",
    "codeMode": "default_on"
  },
  "policy": {
    "capabilityMode": "read_only",
    "credentialCustody": "customer",
    "telemetry": "off"
  },
  "sources": [
    {
      "id": "synthetic-large-source",
      "label": "Synthetic 228-tool read catalogue",
      "url": "https://large-source.example.com/mcp",
      "authentication": {
        "mode": "none",
        "onBehalfOfUser": false
      },
      "enabledTools": [
        "analytics_read_001",
        "analytics_read_002",
        "analytics_read_003",
        "analytics_read_004",
        "analytics_read_005",
        "analytics_read_006",
        "analytics_read_007",
        "analytics_read_008",
        "analytics_read_009",
        "analytics_read_010",
        "analytics_read_011",
        "analytics_read_012",
        "analytics_read_013",
        "analytics_read_014",
        "analytics_read_015",
        "analytics_read_016",
        "analytics_read_017",
        "analytics_read_018",
        "analytics_read_019",
        "catalog_read_001",
        "catalog_read_002",
        "catalog_read_003",
        "catalog_read_004",
        "catalog_read_005",
        "catalog_read_006",
        "catalog_read_007",
        "catalog_read_008",
        "catalog_read_009",
        "catalog_read_010",
        "catalog_read_011",
        "catalog_read_012",
        "catalog_read_013",
        "catalog_read_014",
        "catalog_read_015",
        "catalog_read_016",
        "catalog_read_017",
        "catalog_read_018",
        "catalog_read_019",
        "customers_read_001",
        "customers_read_002",
        "customers_read_003",
        "customers_read_004",
        "customers_read_005",
        "customers_read_006",
        "customers_read_007",
        "customers_read_008",
        "customers_read_009",
        "customers_read_010",
        "customers_read_011",
        "customers_read_012",
        "customers_read_013",
        "customers_read_014",
        "customers_read_015",
        "customers_read_016",
        "customers_read_017",
        "customers_read_018",
        "customers_read_019",
        "documents_read_001",
        "documents_read_002",
        "documents_read_003",
        "documents_read_004",
        "documents_read_005",
        "documents_read_006",
        "documents_read_007",
        "documents_read_008",
        "documents_read_009",
        "documents_read_010",
        "documents_read_011",
        "documents_read_012",
        "documents_read_013",
        "documents_read_014",
        "documents_read_015",
        "documents_read_016",
        "documents_read_017",
        "documents_read_018",
        "documents_read_019",
        "finance_read_001",
        "finance_read_002",
        "finance_read_003",
        "finance_read_004",
        "finance_read_005",
        "finance_read_006",
        "finance_read_007",
        "finance_read_008",
        "finance_read_009",
        "finance_read_010",
        "finance_read_011",
        "finance_read_012",
        "finance_read_013",
        "finance_read_014",
        "finance_read_015",
        "finance_read_016",
        "finance_read_017",
        "finance_read_018",
        "finance_read_019",
        "fulfillment_read_001",
        "fulfillment_read_002",
        "fulfillment_read_003",
        "fulfillment_read_004",
        "fulfillment_read_005",
        "fulfillment_read_006",
        "fulfillment_read_007",
        "fulfillment_read_008",
        "fulfillment_read_009",
        "fulfillment_read_010",
        "fulfillment_read_011",
        "fulfillment_read_012",
        "fulfillment_read_013",
        "fulfillment_read_014",
        "fulfillment_read_015",
        "fulfillment_read_016",
        "fulfillment_read_017",
        "fulfillment_read_018",
        "fulfillment_read_019",
        "inventory_read_001",
        "inventory_read_002",
        "inventory_read_003",
        "inventory_read_004",
        "inventory_read_005",
        "inventory_read_006",
        "inventory_read_007",
        "inventory_read_008",
        "inventory_read_009",
        "inventory_read_010",
        "inventory_read_011",
        "inventory_read_012",
        "inventory_read_013",
        "inventory_read_014",
        "inventory_read_015",
        "inventory_read_016",
        "inventory_read_017",
        "inventory_read_018",
        "inventory_read_019",
        "operations_read_001",
        "operations_read_002",
        "operations_read_003",
        "operations_read_004",
        "operations_read_005",
        "operations_read_006",
        "operations_read_007",
        "operations_read_008",
        "operations_read_009",
        "operations_read_010",
        "operations_read_011",
        "operations_read_012",
        "operations_read_013",
        "operations_read_014",
        "operations_read_015",
        "operations_read_016",
        "operations_read_017",
        "operations_read_018",
        "operations_read_019",
        "orders_read_001",
        "orders_read_002",
        "orders_read_003",
        "orders_read_004",
        "orders_read_005",
        "orders_read_006",
        "orders_read_007",
        "orders_read_008",
        "orders_read_009",
        "orders_read_010",
        "orders_read_011",
        "orders_read_012",
        "orders_read_013",
        "orders_read_014",
        "orders_read_015",
        "orders_read_016",
        "orders_read_017",
        "orders_read_018",
        "orders_read_019",
        "purchasing_read_001",
        "purchasing_read_002",
        "purchasing_read_003",
        "purchasing_read_004",
        "purchasing_read_005",
        "purchasing_read_006",
        "purchasing_read_007",
        "purchasing_read_008",
        "purchasing_read_009",
        "purchasing_read_010",
        "purchasing_read_011",
        "purchasing_read_012",
        "purchasing_read_013",
        "purchasing_read_014",
        "purchasing_read_015",
        "purchasing_read_016",
        "purchasing_read_017",
        "purchasing_read_018",
        "purchasing_read_019",
        "reporting_read_001",
        "reporting_read_002",
        "reporting_read_003",
        "reporting_read_004",
        "reporting_read_005",
        "reporting_read_006",
        "reporting_read_007",
        "reporting_read_008",
        "reporting_read_009",
        "reporting_read_010",
        "reporting_read_011",
        "reporting_read_012",
        "reporting_read_013",
        "reporting_read_014",
        "reporting_read_015",
        "reporting_read_016",
        "reporting_read_017",
        "reporting_read_018",
        "reporting_read_019",
        "support_read_001",
        "support_read_002",
        "support_read_003",
        "support_read_004",
        "support_read_005",
        "support_read_006",
        "support_read_007",
        "support_read_008",
        "support_read_009",
        "support_read_010",
        "support_read_011",
        "support_read_012",
        "support_read_013",
        "support_read_014",
        "support_read_015",
        "support_read_016",
        "support_read_017",
        "support_read_018",
        "support_read_019"
      ]
    }
  ]
}
